{"canonicalUrl":"pkg:omena-fixture/external-sif-trust.css","dependencies":[],"exports":{"forwards":[],"functions":[],"mixins":[],"placeholders":[],"variables":[]},"fingerprints":{"hashAlgorithm":"blake3","interfaceHash":"blake3:19f7f4820be2e4d8cf24ac0478796ea8cf40f84eb96ceefc826613f1281f2909","leafHash":"blake3:275028c00c605cb30f2e194f85456d309657d68d6fb0f6145822d36eb6449ac6","transitiveHash":"blake3:279369e6c2f4a714e8acffc5970acd1005bda85d979b7f516e1b354f5e05f866"},"generator":{"name":"omena-sifgen-static","toolchainId":"omena-sifgen-static@0.2.0","version":"0.2.0"},"sifVersion":"1","source":{"syntax":"css"}}
